{
  "schema_version": "1.0",
  "repository": "python-design-pattern-rag",
  "source_commit": "0bc24c7",
  "index_definition": {
    "unit_order_source": "labs/index.md",
    "learning_units": 28,
    "categories": ["behavioral", "creational", "structural"],
    "pattern_kinds": ["gof", "python_idiom", "architecture"]
  },
  "chapters": [
    {
      "id": "lab-01-chain-of-responsibility",
      "lab_no": 1,
      "title": {"en": "Chain Of Responsibility", "zh": "责任链模式"},
      "aliases": ["Chain of Responsibility", "CoR", "责任链"],
      "category": "behavioral",
      "pattern_kind": "gof",
      "summary": "Sends a request along a chain of potential handlers and decouples the sender from its receivers.",
      "keywords": ["handler chain", "set_next", "pass_to_next", "unhandled request", "loose coupling"],
      "knowledge_points": [
        {
          "id": "lab-01-chain-of-responsibility-kp-role",
          "type": "pattern_role",
          "text": "Each handler decides either to process a request or forward it to the next handler; the client only knows the first handler.",
          "source_files": ["labs/behavioral_chain_of_responsibility.md", "docs/behavioral_chain_of_responsibility.md"],
          "evidence": "Each handler decides either to process a request or to forward it to the next handler in the chain.",
          "confidence": "confirmed"
        },
        {
          "id": "lab-01-chain-of-responsibility-kp-python-technique",
          "type": "python_technique",
          "text": "The reference implementation exposes set_next, handle, and pass_to_next; set_next returns the next handler to support chained assignment.",
          "source_files": ["labs/behavioral_chain_of_responsibility.md", "patterns/behavioral/chain_of_responsibility.py"],
          "evidence": "Review the Handler base class: set_next, handle, and pass_to_next.",
          "confidence": "confirmed"
        },
        {
          "id": "lab-01-chain-of-responsibility-kp-pitfall",
          "type": "pitfall",
          "text": "a.set_next(b).set_next(c) links b to c rather than a to c; unhandled requests and circular chains must be handled explicitly.",
          "source_files": ["labs/behavioral_chain_of_responsibility.md"],
          "evidence": "Forgetting that set_next returns the next handler, so a.set_next(b).set_next(c) links b to c, not a to c.",
          "confidence": "confirmed"
        }
      ],
      "sources": [
        {"path": "labs/behavioral_chain_of_responsibility.md", "type": "lab"},
        {"path": "docs/behavioral_chain_of_responsibility.md", "type": "lesson"},
        {"path": "patterns/behavioral/chain_of_responsibility.py", "type": "reference_implementation"}
      ]
    },
    {
      "id": "lab-02-command",
      "lab_no": 2,
      "title": {"en": "Command", "zh": "命令模式"},
      "aliases": ["Command Pattern", "命令"],
      "category": "behavioral",
      "pattern_kind": "gof",
      "summary": "Encapsulates a request as an object so the invoker is decoupled from the receiver.",
      "keywords": ["command", "invoker", "receiver", "undo", "queue"],
      "knowledge_points": [
        {
          "id": "lab-02-command-kp-role",
          "type": "pattern_role",
          "text": "The four roles are Command, ConcreteCommand, Invoker, and Receiver; the invoker only knows execute.",
          "source_files": ["labs/behavioral_command.md", "docs/behavioral_command.md"],
          "evidence": "The Command pattern turns a request into a standalone object that carries all the information needed to perform an action.",
          "confidence": "confirmed"
        },
        {
          "id": "lab-02-command-kp-python-technique",
          "type": "python_technique",
          "text": "A concrete command receives the receiver through its constructor and calls the receiver method from execute.",
          "source_files": ["labs/behavioral_command.md", "patterns/behavioral/command.py"],
          "evidence": "Forgetting to pass the receiver into the concrete command's constructor.",
          "confidence": "confirmed"
        },
        {
          "id": "lab-02-command-kp-lab-task",
          "type": "lab_task",
          "text": "Add a Stereo receiver and StereoOnCommand and StereoVolumeCommand concrete commands, then submit them through RemoteControl.",
          "source_files": ["labs/behavioral_command.md"],
          "evidence": "Add a Stereo receiver with turn_on, turn_off, and set_volume(level) methods.",
          "confidence": "confirmed"
        }
      ],
      "sources": [
        {"path": "labs/behavioral_command.md", "type": "lab"},
        {"path": "docs/behavioral_command.md", "type": "lesson"},
        {"path": "patterns/behavioral/command.py", "type": "reference_implementation"}
      ]
    },
    {
      "id": "lab-03-interpreter",
      "lab_no": 3,
      "title": {"en": "Interpreter", "zh": "解释器模式"},
      "aliases": ["Interpreter Pattern", "解释器"],
      "category": "behavioral",
      "pattern_kind": "gof",
      "summary": "Represents a grammar as a tree of expression objects and evaluates sentences by traversing the tree.",
      "keywords": ["grammar", "terminal expression", "non-terminal expression", "context", "AST"],
      "knowledge_points": [
        {
          "id": "lab-03-interpreter-kp-role",
          "type": "pattern_role",
          "text": "Terminal expressions such as Variable and non-terminal expressions such as Add and Subtract form an expression tree evaluated with interpret.",
          "source_files": ["labs/behavioral_interpreter.md", "docs/behavioral_interpreter.md"],
          "evidence": "The Interpreter pattern defines a representation for a language's grammar and evaluates sentences of that language by traversing the expression tree.",
          "confidence": "confirmed"
        },
        {
          "id": "lab-03-interpreter-kp-python-technique",
          "type": "python_technique",
          "text": "The reference Variable.interpret treats a missing variable as 0, which is useful but can hide typos.",
          "source_files": ["labs/behavioral_interpreter.md", "patterns/behavioral/interpreter.py"],
          "evidence": "Because z is missing from the context and defaults to 0: 10 + (5 - 0) = 15.",
          "confidence": "confirmed"
        },
        {
          "id": "lab-03-interpreter-kp-lab-task",
          "type": "lab_task",
          "text": "Implement a Multiply non-terminal expression and evaluate (x + y) * z.",
          "source_files": ["labs/behavioral_interpreter.md"],
          "evidence": "Implement a Multiply non-terminal expression and build the expression (x + y) * z with z = 3.",
          "confidence": "confirmed"
        }
      ],
      "sources": [
        {"path": "labs/behavioral_interpreter.md", "type": "lab"},
        {"path": "docs/behavioral_interpreter.md", "type": "lesson"},
        {"path": "patterns/behavioral/interpreter.py", "type": "reference_implementation"}
      ]
    },
    {
      "id": "lab-04-memento",
      "lab_no": 4,
      "title": {"en": "Memento", "zh": "备忘录模式"},
      "aliases": ["Memento Pattern", "备忘录"],
      "category": "behavioral",
      "pattern_kind": "gof",
      "summary": "Captures an object's internal state into a memento so it can be restored later without breaking encapsulation.",
      "keywords": ["originator", "memento", "caretaker", "undo", "restore"],
      "knowledge_points": [
        {
          "id": "lab-04-memento-kp-role",
          "type": "pattern_role",
          "text": "The roles are Originator, Memento, and Caretaker; the caretaker stores history but does not inspect state.",
          "source_files": ["labs/behavioral_memento.md", "docs/behavioral_memento.md"],
          "evidence": "The Memento pattern captures an object's internal state into a memento object so it can be restored later.",
          "confidence": "confirmed"
        },
        {
          "id": "lab-04-memento-kp-python-technique",
          "type": "python_technique",
          "text": "Save should return a copy of the state so the memento cannot be tampered with.",
          "source_files": ["labs/behavioral_memento.md"],
          "evidence": "Make TextEditor.save defensive by returning a copy of the state so the memento cannot be tampered with.",
          "confidence": "confirmed"
        },
        {
          "id": "lab-04-memento-kp-pitfall",
          "type": "pitfall",
          "text": "Backing up after the change instead of before it restores the wrong state.",
          "source_files": ["labs/behavioral_memento.md"],
          "evidence": "Backing up after the change instead of before it, which makes undo restore the wrong state.",
          "confidence": "confirmed"
        }
      ],
      "sources": [
        {"path": "labs/behavioral_memento.md", "type": "lab"},
        {"path": "docs/behavioral_memento.md", "type": "lesson"},
        {"path": "patterns/behavioral/memento.py", "type": "reference_implementation"}
      ]
    },
    {
      "id": "lab-05-observer",
      "lab_no": 5,
      "title": {"en": "Observer", "zh": "观察者模式"},
      "aliases": ["Observer Pattern", "观察者"],
      "category": "behavioral",
      "pattern_kind": "gof",
      "summary": "Defines a one-to-many dependency where a subject notifies attached observers when state changes.",
      "keywords": ["subject", "observer", "attach", "detach", "notify", "push vs pull"],
      "knowledge_points": [
        {
          "id": "lab-05-observer-kp-role",
          "type": "pattern_role",
          "text": "A Subject maintains observers and calls notify; observers register through attach and detach.",
          "source_files": ["labs/behavioral_observer.md", "docs/behavioral_observer.md"],
          "evidence": "The Observer pattern defines a subject that keeps a list of observers and notifies them whenever its state changes.",
          "confidence": "confirmed"
        },
        {